### ISSUE TITLE
[dev.icinga.com #11282] Graphite writer stops sending updates

### ISSUE THREAD

**Issue by icinga-migration** [Icinga/icinga2#3992]
This issue has been migrated from Redmine: https://dev.icinga.com/issues/11282

**Created by greatexpectations on 2016-03-02 21:46:40 +00:00**

Assignee: _(none)_
Status: _Rejected_  (closed on _2016-03-05 17:33:42 +00:00_)
Target Version: _(none)_
Last Update: _2016-03-05 17:33:42 +00:00 (in Redmine)_

    Icinga Version: 2.4.3
    Backport?: Not yet backported
    Include in Changelog: 1

---

Greetings,

since the update to Icinga 2.4.3, the GraphiteWriter has stopped working for one of our Icinga servers.

We use the default configuration (e.g. write to a carbon-cache process running on the same host on port 2003/tcp):

    object GraphiteWriter "graphite" {
        // host = "127.0.0.1"
        // port = 2003
    }

Immediately after recycling the Icinga2 process, the writer sometimes successfully sends a few metrics:

    # grep -i graphitewriter /var/log/icinga2/debug.log
    [2016-03-02 21:49:39 +0100] notice/GraphiteWriter: Reconnecting to Graphite on host '127.0.0.1' port '2003'.
    [2016-03-02 21:49:40 +0100] debug/GraphiteWriter: Add to metric list:'icinga2.somehost.host.hostalive.perfdata.rta.value 0.00075799999999999999 1456951785'.
    [2016-03-02 21:49:40 +0100] debug/GraphiteWriter: Add to metric list:'icinga2.somehost.host.hostalive.perfdata.pl.value 0 1456951785'.
    [2016-03-02 21:49:40 +0100] debug/GraphiteWriter: Add to metric list:'icinga2.someotherhost.host.hostalive.perfdata.rta.value 0.00027500000000000002 1456951779'.
    ...

    # tcpdump -n -i lo port 2003
    tcpdump: verbose output suppressed, use -v or -vv for full protocol decode
    listening on lo, link-type EN10MB (Ethernet), capture size 65535 bytes
    22:28:22.477982 IP 172.25.0.39.59769 > 127.0.0.1.cfinger: Flags [F.], seq 2904750338, ack 3043553169, win 342, options [nop,nop,TS val 1256310936 ecr 1256226302], length 0
    22:28:22.478821 IP 127.0.0.1.cfinger > 127.0.0.1.59769: Flags [.], ack 2904750339, win 342, options [nop,nop,TS val 1256310937 ecr 1256310936], length 0
    22:28:22.479019 IP 127.0.0.1.cfinger > 127.0.0.1.59769: Flags [F.], seq 0, ack 1, win 342, options [nop,nop,TS val 1256310937 ecr 1256310936], length 0
    22:28:22.479036 IP 172.25.0.39.59769 > 127.0.0.1.cfinger: Flags [.], ack 2, win 342, options [nop,nop,TS val 1256310937 ecr 1256310937], length 0
    22:28:23.422115 IP 172.25.0.39.59878 > 127.0.0.1.cfinger: Flags [S], seq 1822951236, win 43690, options [mss 65495,sackOK,TS val 1256311880 ecr 0,nop,wscale 7], length 0
    08:59:05.021613 IP 127.0.0.1.cfinger > 127.0.0.1.59878: Flags [S.], seq 2975589704, ack 1822951237, win 43690, options [mss 65495,sackOK,TS val 1256311880 ecr 1256311880,nop,wscale 7], length 0
    22:28:23.422166 IP 172.25.0.39.59878 > 127.0.0.1.cfinger: Flags [.], ack 2975589705, win 342, options [nop,nop,TS val 1256311880 ecr 1256311880], length 0
    22:28:23.623674 IP 172.25.0.39.59878 > 127.0.0.1.cfinger: Flags [P.], seq 0:102, ack 1, win 342, options [nop,nop,TS val 1256312081 ecr 1256311880], length 102
    22:28:23.623698 IP 127.0.0.1.cfinger > 127.0.0.1.59878: Flags [.], ack 103, win 342, options [nop,nop,TS val 1256312081 ecr 1256312081], length 0
    ...

But from then on, no further updates are ever sent. Manually feeding data to carbon-cache works without any problem:

    # echo "icinga2.somehost.host.hostalive.perfdata.rta.value 0.00075799999999999999 $(date +%s)"|nc 127.0.0.1 2003

    --> Whisper file is updated

Kind Regards
