### ISSUE TITLE
ping4 using ipv6 address from dns resolved hostname

### ISSUE THREAD

**Issue by lager1** [Icinga/icinga2#6631]
We discovered that monitoring plugin ping4 has quite strange behavior when the destination DNS name provides IPv6 addresses in form of AAAA DNS records but does not respond to ICMP over IPv6.

## Expected Behavior

When using ping4, the plugin should only use DNS A records when given a DNS hostname.

## Current Behavior

When used for "problematic" DNS record:

```
'/usr/lib/nagios/plugins/check_ping' '-4' '-H' 'er.zskunstat.cz' '-c' '2000,100%' '-w' '1500,60%'
PING CRITICAL - Packet loss = 100%|rta=2000.000000ms;1500.000000;2000.000000;0.000000 pl=100%;60;100;0 
``` 

tcpdump of this test:
```
tcpdump -n host 82.117.152.45 or host 2001:1a48:b:8000:1::20
tcpdump: verbose output suppressed, use -v or -vv for full protocol decode
listening on eno1, link-type EN10MB (Ethernet), capture size 262144 bytes
11:45:30.791150 IP6 2001:718:1:e::233:246 > 2001:1a48:b:8000:1::20: ICMP6, echo request, seq 1, length 64
11:45:31.814424 IP6 2001:718:1:e::233:246 > 2001:1a48:b:8000:1::20: ICMP6, echo request, seq 2, length 64
11:45:32.838417 IP6 2001:718:1:e::233:246 > 2001:1a48:b:8000:1::20: ICMP6, echo request, seq 3, length 64
11:45:33.862414 IP6 2001:718:1:e::233:246 > 2001:1a48:b:8000:1::20: ICMP6, echo request, seq 4, length 64
11:45:34.886426 IP6 2001:718:1:e::233:246 > 2001:1a48:b:8000:1::20: ICMP6, echo request, seq 5, length 64
11:45:35.914431 IP6 2001:718:1:e::233:246 > 2001:1a48:b:8000:1::20: ICMP6, echo request, seq 6, length 64
11:45:36.934426 IP6 2001:718:1:e::233:246 > 2001:1a48:b:8000:1::20: ICMP6, echo request, seq 7, length 64
11:45:37.958399 IP6 2001:718:1:e::233:246 > 2001:1a48:b:8000:1::20: ICMP6, echo request, seq 8, length 64
11:45:38.982429 IP6 2001:718:1:e::233:246 > 2001:1a48:b:8000:1::20: ICMP6, echo request, seq 9, length 64
11:45:40.006435 IP6 2001:718:1:e::233:246 > 2001:1a48:b:8000:1::20: ICMP6, echo request, seq 10, length 64
11:45:41.030436 IP6 2001:718:1:e::233:246 > 2001:1a48:b:8000:1::20: ICMP6, echo request, seq 11, length 64
11:45:42.054428 IP6 2001:718:1:e::233:246 > 2001:1a48:b:8000:1::20: ICMP6, echo request, seq 12, length 64
11:45:43.078423 IP6 2001:718:1:e::233:246 > 2001:1a48:b:8000:1::20: ICMP6, echo request, seq 13, length 64
11:45:44.102433 IP6 2001:718:1:e::233:246 > 2001:1a48:b:8000:1::20: ICMP6, echo request, seq 14, length 64
11:45:45.126422 IP6 2001:718:1:e::233:246 > 2001:1a48:b:8000:1::20: ICMP6, echo request, seq 15, length 64
```

The host er.zskunstat.cz does not respond to ping over IPv6, but it does over IPv4:

```
dig +short er.zskunstat.cz
82.117.152.45
'/usr/lib/nagios/plugins/check_ping' '-4' '-H' '82.117.152.45' '-c' '2000,100%' '-w' '1500,60%'
PING OK - Packet loss = 0%, RTA = 6.11 ms|rta=6.105000ms;1500.000000;2000.000000;0.000000 pl=0%;60;100;0 
``` 

## Steps to Reproduce (for bugs)

1. Add host to icinga2.
2. Create AAAA DNS record for it.
3. Set host to IPv4 only.
4. Run ping4 test against it.

## Your Environment

* Version used (`icinga2 --version`):
```
icinga2 - The Icinga 2 network monitoring daemon (version: r2.9.1-1)

Copyright (c) 2012-2018 Icinga Development Team (https://www.icinga.com/)
License GPLv2+: GNU GPL version 2 or later <http://gnu.org/licenses/gpl2.html>
This is free software: you are free to change and redistribute it.
There is NO WARRANTY, to the extent permitted by law.

Application information:
  Installation root: /usr
  Sysconf directory: /etc
  Run directory: /run
  Local state directory: /var
  Package data directory: /usr/share/icinga2
  State path: /var/lib/icinga2/icinga2.state
  Modified attributes path: /var/lib/icinga2/modified-attributes.conf
  Objects path: /var/cache/icinga2/icinga2.debug
  Vars path: /var/cache/icinga2/icinga2.vars
  PID path: /run/icinga2/icinga2.pid

System information:
  Platform: Debian GNU/Linux
  Platform version: 9 (stretch)
  Kernel: Linux
  Kernel version: 4.9.0-8-amd64
  Architecture: x86_64

Build information:
  Compiler: GNU 6.3.0
  Build host: 83e7f59f33f0
```
* Operating System and version:
```
Distributor ID:	Debian
Description:	Debian GNU/Linux 9.5 (stretch)
Release:	9.5
Codename:	stretch
```
* Enabled features (`icinga2 feature list`):
```
Disabled features: command compatlog debuglog elasticsearch gelf graphite influxdb livestatus opentsdb perfdata statusdata syslog
Enabled features: api checker ido-mysql mainlog notification
```
* Icinga Web 2 version and modules (System - About):
icingaweb2 2.6.1
director @ `3c02f7499fe06299af083cb723be236555efaf93`
monitoring 2.6.1
* Config validation (`icinga2 daemon -C`):
```
[2018-09-20 15:19:48 +0200] information/cli: Icinga application loader (version: r2.9.1-1)
[2018-09-20 15:19:48 +0200] information/cli: Loading configuration file(s).
[2018-09-20 15:19:49 +0200] information/ConfigItem: Committing config item(s).
[2018-09-20 15:19:49 +0200] information/ApiListener: My API identity: ermon.cesnet.cz
[2018-09-20 15:19:59 +0200] information/WorkQueue: #4 (DaemonUtility::LoadConfigFiles) items: 0, rate: 32.5833/s (1955/min 1955/5min 1955/15min);
[2018-09-20 15:19:59 +0200] information/WorkQueue: #5 (IdoMysqlConnection, ido-mysql) items: 0, rate:  0/s (0/min 0/5min 0/15min);
[2018-09-20 15:19:59 +0200] information/WorkQueue: #7 (ApiListener, SyncQueue) items: 0, rate:  0/s (0/min 0/5min 0/15min);
[2018-09-20 15:19:59 +0200] information/WorkQueue: #6 (ApiListener, RelayQueue) items: 0, rate:  0/s (0/min 0/5min 0/15min);
[2018-09-20 15:20:06 +0200] warning/ApplyRule: Apply rule 'COMPROMISED-USERS-osmec.cz' (in /var/lib/icinga2/api/packages/director/906ca4bb-0a2c-45fb-9bf1-a3f4f6afdbdf/zones.d/director-global/service_apply_rules/static_config.conf: 64:5-64:60) for type 'Service' does not match anywhere!
[2018-09-20 15:20:06 +0200] warning/ApplyRule: Apply rule 'CONCURRENT-INST-osmec.cz' (in /var/lib/icinga2/api/packages/director/906ca4bb-0a2c-45fb-9bf1-a3f4f6afdbdf/zones.d/director-global/service_apply_rules/static_config.conf: 86:5-86:58) for type 'Service' does not match anywhere!
[2018-09-20 15:20:06 +0200] information/ConfigItem: Instantiated 45040 Services.
[2018-09-20 15:20:06 +0200] information/ConfigItem: Instantiated 239 ServiceGroups.
[2018-09-20 15:20:06 +0200] information/ConfigItem: Instantiated 225 HostGroups.
[2018-09-20 15:20:06 +0200] information/ConfigItem: Instantiated 1 FileLogger.
[2018-09-20 15:20:06 +0200] information/ConfigItem: Instantiated 1 NotificationComponent.
[2018-09-20 15:20:06 +0200] information/ConfigItem: Instantiated 2 NotificationCommands.
[2018-09-20 15:20:06 +0200] information/ConfigItem: Instantiated 45040 Notifications.
[2018-09-20 15:20:06 +0200] information/ConfigItem: Instantiated 1 IcingaApplication.
[2018-09-20 15:20:06 +0200] information/ConfigItem: Instantiated 236 Hosts.
[2018-09-20 15:20:06 +0200] information/ConfigItem: Instantiated 1 ApiListener.
[2018-09-20 15:20:06 +0200] information/ConfigItem: Instantiated 85619 Dependencies.
[2018-09-20 15:20:06 +0200] information/ConfigItem: Instantiated 1 Comment.
[2018-09-20 15:20:06 +0200] information/ConfigItem: Instantiated 1 CheckerComponent.
[2018-09-20 15:20:06 +0200] information/ConfigItem: Instantiated 4 Zones.
[2018-09-20 15:20:06 +0200] information/ConfigItem: Instantiated 2 Endpoints.
[2018-09-20 15:20:06 +0200] information/ConfigItem: Instantiated 2 ApiUsers.
[2018-09-20 15:20:06 +0200] information/ConfigItem: Instantiated 235 UserGroups.
[2018-09-20 15:20:06 +0200] information/ConfigItem: Instantiated 1 IdoMysqlConnection.
[2018-09-20 15:20:06 +0200] information/ConfigItem: Instantiated 229 CheckCommands.
[2018-09-20 15:20:06 +0200] information/ConfigItem: Instantiated 3 TimePeriods.
[2018-09-20 15:20:06 +0200] information/ConfigItem: Instantiated 311 Users.
[2018-09-20 15:20:06 +0200] information/ScriptGlobal: Dumping variables to file '/var/cache/icinga2/icinga2.vars'
[2018-09-20 15:20:06 +0200] information/cli: Finished validating the configuration file(s).
```

**Comment by lager1** [comment]
This issue was moved to monitoring-plugins/monitoring-plugins#1550
